Utterance,Cluster,processed_queries
πώς μπορώ να ενημερωθώ για τον τρόπο που μπορεί να γίνει αίτηση,,πώς μπορώ ενημερωθώ τρόπος μπορώ γίνομαι αίτηση
θέλω να ενημερωθώ για αναλυτικό λογαριασμό στο κινητό,,ενημερωθώ αναλυτικός λογαριασμός σε ο κινητό
θέλω να ενημερωθώ για υπηρεσίες,,ενημερωθώ υπηρεσία
ενδιαφέρομαι να μου απενεργοποιήσετε,,ενδιαφέρομαι απενεργοποιήσω
αναφορά παραπόνου,,αναφορά παραπόνου
να γίνει απόρρητο το τηλέφωνο,,γίνομαι απόρρητος τηλέφωνος
να ενημερωθώ για τις βιντεοκλήσεις,,ενημερωθώς βιντεοκλήσεις
ανάλυση εισερχόμενων κλήσεων,,ανάλυση εισερχόμενος κλήσεων
πόσο χρωστάω,,πόσο χρωστάω
θα ήθελα να υποβάλω αίτηση,,υποβάλω αίτηση
να εξοφλήσω το σταθερό μου,,εξοφλώ σταθερός
θα ήθελα να μάθω λεπτομέρειες σχετικά με τον διακανονισμό,,μάθω λεπτομέρεια σχετικά διακανονισμός
ενδιαφέρομαι να αποκτήσω ένα νέο tablet,,ενδιαφέρομαι αποκτώ ένας νέος tablet
τον λογαριασμό της σύνδεσής μου,,λογαριασμός σύνδεση
επιθυμώ να μιλήσω με τις πωλήσεις,,επιθυμώ μιλώ πωλήσεις
να ενημερωθώ για την παρούσα κατάσταση του υπολοίπου μου,,ενημερωθώ παρών κατάσταση υπολοίπου
θέλω να κάνω το κινητό μου απόρρητο,,κινητό απόρρητο
επιθυμώ ενημέρωση,,επιθυμώ ενημέρωση
πώς μπορώ να κάνω διακανονισμό κινητής,,πώς μπορώ διακανονισμός κινητός
πώς μπορώ να καταχωρήσω αίτημα,,πώς μπορώ καταχωρώ αίτημα
θέλω να αναφέρω παράπονο,,αναφέρω παράπονο
δε βρίσκω να ανοίξω το hotspot στη συσκευή μου,,βρίσκω ανοίξω hotspot σε ο συσκευή
πού θα βρω πόσα χρωστάω,,πού βρως χρωστάω
πότε θα γίνει το νέο ραντεβού,,πότε γίνομαι νέος ραντεβού
από πού αλλάζει ο κωδικός του tethering,,από πού αλλάζω κωδικός tethering
θέλω να με ενημερώσετε για αναλυτικό λογαριασμό στο κινητό,,ενημερώσω αναλυτικός λογαριασμός σε ο κινητό
θα επιθυμούσα να μάθω πόσες δόσεις απομένουν ακόμη για τον διακανονισμό,,επιθυμούσος μάθω πόσος δόση απομένω ακόμα διακανονισμός
αγορά προγράμματος δεδομένων,,αγορά πρόγραμμα δεδομένο
πώς κάνω hotspot,,πώς hotspot
ενημερώστε με για την ανάλυση των κλήσεων,,ενημερώστε ανάλυση κλήσεων
να ανανεώσω θέλω,,ανανεώσω
βρήκα αναπάντητη στο σταθερό τηλέφωνο από εσάς,,βρήκα αναπάντητος σε ο σταθερός τηλέφωνος από
ενεργοποίηση,,ενεργοποίηση
θέλω πληροφορίες,,πληροφορία
πού μπορώ να βρω τα χρέη μου,,πού μπορώ βρως χρέος
θέλω να βρω τον αναλυτικό λογαριασμό του σταθερού,,βρως αναλυτικός λογαριασμός σταθερού
θέλω να μιλήσω για ένα ραντεβού,,μιλώ ένας ραντεβού
να πληροφορηθώ,,πληροφορηθώ
λογαριασμός κινητής,,λογαριασμός κινητός
δωρεάν χρόνος ομιλίας,,δωρεάν χρόνος ομιλία
ενημέρωση για την απόκρυψη κλήσεων,,ενημέρωση απόκρυψη κλήσεων
από πού αλλάζει ο κωδικός του hotspot,,από πού αλλάζω κωδικός hotspot
τον λογαριασμό του σταθερού μου,,λογαριασμός σταθερού
θέλω να ενημερωθώ πότε πρέπει να πληρώνω τις δόσεις του διακανονισμού μου,,ενημερωθώ πότε πρέπει πληρώνω δόση διακανονισμός
θέλω να ενεργοποιήσω πρόγραμμα ομιλίας,,ενεργοποιήσω πρόγραμμα ομιλία
είχα μία κλήση στο τηλέφωνό μου από εσάς και σας κάλεσα,,ένας κλήση σε ο τηλέφωνό από κάλεσα
θέλω να δω αναλυτικά την κίνηση των κλήσεών μου,,αναλυτικά κίνηση κλήσεών
επιθυμώ να προσθέσω χρόνο ομιλίας,,επιθυμώ προσθέσω χρόνος ομιλία
θέλω να μου βάλετε χρόνο για να μιλάω,,βάλετε χρόνος μιλάως
υπάρχουν άλλες υπηρεσίες πέρα από αυτές που έχω,,υπάρχω άλλος υπηρεσία πέρα από αυτός
θέλω να βάλω λεπτά ομιλίας στην κάρτα,,βάλω λεπτό ομιλία σε ο κάρτα
να κάνω εξόφληση λογαριασμού,,εξόφληση λογαριασμός
θέλω να μάθω πότε πρέπει να πληρώνω τις δόσεις του διακανονισμού μου,,μάθω πότε πρέπει πληρώνω δόση διακανονισμός
ενημέρωση για τις υπηρεσίες,,ενημέρωση υπηρεσία
τι υπόλοιπο έχω,,υπόλοιπος
λειτουργία της βιντεοκλήσης,,λειτουργία βιντεοκλήση
θέλω να ενεργοποιηθεί,,ενεργοποιηθεί
θέλω να καταχωρήσω αίτηση,,καταχωρώ αίτηση
θα ήθελα παρακαλώ να κάνω διακανονισμό του ληξιπρόθεσμου και του τρέχοντος λογαριασμού μου,,παρακαλώ διακανονισμός ληξιπρόθεσμου τρέχον λογαριασμός
ποιες υπηρεσίες έχω ήδη,,ποιος υπηρεσία ήδη
πώς κάνω tethering τη συσκευή μου,,πώς tethering συσκευή
θέλω να ενημερωθώ για τα οφειλόμενά μου,,ενημερωθώ οφειλόμενό
το τμήμα παραπόνων θέλω,,τμήμα παραπόνων
σχετικά με λογαριασμό σταθερού,,σχετικά λογαριασμός σταθερού
θέλω να με ενημερώσετε για αναλυτικό λογαριασμό στο σταθερό,,ενημερώσω αναλυτικός λογαριασμός σε ο σταθερός
τον λογαριασμό του συμβολαίου μου,,λογαριασμός συμβολαίου
πού μπορώ να δω την οφειλή μου,,πού μπορώ οφειλή
ποιο είναι το τελικό ποσό των χρεών μου,,ποιος τελικός ποσό χρεών
να κάνω αποπληρωμή λογαριασμού,,αποπληρωμή λογαριασμός
μπορώ να προχωρήσω σε διακανονισμό του σταθερού μου,,μπορώ προχωρώ διακανονισμός σταθερού
καινούργια υπηρεσία,,καινούργια υπηρεσία
χρήση της υπηρεσίας της βιντεοκλήσης,,χρήση υπηρεσία βιντεοκλήση
να μάθω το υπόλοιπό μου,,μάθω υπόλοιπος
για τον λογαριασμό μου,,λογαριασμός
ζητώ να ενεργοποιήσω,,ζητώ ενεργοποιήσω
επιθυμώ απενεργοποίηση,,επιθυμώ απενεργοποίηση
να μου δείξετε πού είναι ο αναλυτικός λογαριασμός,,δείξω πού αναλυτικός λογαριασμός
να εξοφλήσω το τηλέφωνό μου,,εξοφλώ τηλέφωνό
θέλω να εκφράσω παράπονο,,εκφράζω παράπονο
ανάλυση κλήσεων,,ανάλυση κλήσεων
πού μπορώ να κάνω αίτηση για φοιτητικό,,πού μπορώ αίτηση φοιτητικός
επιθυμώ να γνωρίζω την οφειλή μου,,επιθυμώ γνωρίζω οφειλή
χρειάζομαι ανάλυση του λογαριασμού μου,,χρειάζομαι ανάλυση λογαριασμός
από πού κλείνει το tethering,,από πού κλείνω tethering
θέλω να κάνω αποπληρωμή της οφειλής του κινητού μου,,αποπληρωμή οφειλή κινητός
θα μου δείξετε πώς να κάνω hotspot,,δείξω πώς hotspot
λογαριασμός σύνδεσης,,λογαριασμός σύνδεση
θέλω να δω την ανάλυση κλήσεων,,ανάλυση κλήσεων
θέλω να αγοράσω χρόνο ομιλίας προς κινητά,,αγοράζω χρόνος ομιλία προς κινητάς
θέλω να δω μια μερική ανάλυση των κλήσεων μου,,ένας μερικός ανάλυση κλήσεων
τo παραστατικό του καρτοσυμβολαίου μου,,παραστατικός καρτοσυμβολαίο
θέλω να γίνει εξόφληση λογαριασμού για το σταθερό μου,,γίνομαι εξόφληση λογαριασμός σταθερός
θέλω να γίνει εξόφληση παραστατικού του τηλεφώνου μου,,γίνομαι εξόφληση παραστατικός τηλεφώνου
θέλω να κάνω πληρωμή της οφειλής του κινητού μου,,πληρωμή οφειλή κινητός
θέλω χρόνο για να τα λέω με τους φίλους μου,,χρόνος λέως φίλος
με ποιον τρόπο να καταχωρήσω αίτηση,,τρόπος καταχωρώ αίτηση
πού μπορώ να δω το χρέος μου,,πού μπορώ χρέος
θέλω να γίνει αποπληρωμή της οφειλής του τηλεφώνου μου,,γίνομαι αποπληρωμή οφειλή τηλεφώνου
θα ήθελα να κάνω μερικές ερωτήσεις σχετικά με τον διακανονισμό,,μερικοί ερωτήσεις σχετικά διακανονισμός
τι παροχές έχει το φοιτητικό,,παροχή φοιτητικός
να πω το παράπονό μου,,λέγω παράπονό
τo παραστατικό του κινητού μου,,παραστατικός κινητός
καλώ για να τροποποιήσω ένα ραντεβού,,καλώ τροποποιώ ένας ραντεβού
θέλω να βάλω χρόνο ομιλίας στην κάρτα,,βάλω χρόνος ομιλία σε ο κάρτα
διακανονισμός ληξιπρόθεσμου,,διακανονισμός ληξιπρόθεσμου
θα ήθελα να μιλήσω με το τμήμα διακανονισμού λογαριασμών,,μιλώ τμήμα διακανονισμός λογαριασμός
πώς μπορώ να βλέπω αναλυτικά τις κλήσεις στον λογαριασμό μου,,πώς μπορώ βλέπω αναλυτικά κλήσεις σε ο λογαριασμός
επιθυμώ να βάλω λεπτά ομιλίας στην κάρτα,,επιθυμώ βάλω λεπτό ομιλία σε ο κάρτα
να κάνω δήλωση του σταθερού μου ως απόρρητο,,δήλωση σταθερού ως απόρρητος
υπόλοιπο,,υπόλοιπος
θέλω να γίνει αποπληρωμή της οφειλής του κινητού μου,,γίνομαι αποπληρωμή οφειλή κινητός
θα ήθελα να ρωτήσω πώς μπορώ να κάνω το φοιτητικό πακέτο,,ρωτώ πώς μπορώ φοιτητικός πακέτο
λεπτά για ομιλία,,λεπτό ομιλία
τον λογαριασμό του κινητού μου,,λογαριασμός κινητός
πώς θα κάνω διακανονισμό οφειλής,,πώς διακανονισμός οφειλή
πού είναι το υπόλοιπο,,πού υπόλοιπος
χρειάζομαι βοήθεια σε ένα θέμα,,χρειάζομαι βοήθεια ένας θέμα
έχετε κάπου οδηγίες για tethering,,κάπου οδηγία tethering
ενημερώστε με για τον αναλυτικό λογαριασμό,,ενημερώστε αναλυτικός λογαριασμός
πόσα χρήματα χρωστάω,,πόσος χρήμα χρωστάω
ενημέρωση για τον αναλυτικό λογαριασμό,,ενημέρωση αναλυτικός λογαριασμός
επιθυμώ να κάνω αίτηση,,επιθυμώ αίτηση
θέλω να μάθω πόσα χρωστάω,,μάθω χρωστάω
είχα μιλήσει να πάρω ένα καινούργιο φοιτητικό πακέτο,,μιλήνω πάρω ένας καινούργιος φοιτητικός πακέτο
νέα υπηρεσία,,νέος υπηρεσία
ενεργοποίηση προγράμματος με mb,,ενεργοποίηση πρόγραμμα mb
να πληροφορηθώ για το υπόλοιπό μου,,πληροφορηθώ υπόλοιπος
αγορά προγράμματος με δεδομένα,,αγορά πρόγραμμα δεδομένας
θέλω να βλέπω αναλυτικό λογαριασμό,,βλέπω αναλυτικός λογαριασμός
βοηθήστε με,,βοηθήστε
δεν έχει ενημερωθεί το υπόλοιπο μου,,ενημερωθεί υπόλοιπος
θέλω να γίνει εξόφληση λογαριασμού για το τηλέφωνο μου,,γίνομαι εξόφληση λογαριασμός τηλέφωνος
να επιλέξω μία υπηρεσία,,επιλέξω ένας υπηρεσία
είχα μία κλήση στο σταθερό τηλέφωνό μου από εσάς,,ένας κλήση σε ο σταθερό τηλέφωνό από
πληροφορίες για την απόκρυψη κλήσεων,,πληροφορία απόκρυψη κλήσεων
θέλω να γίνει εξόφληση της οφειλής του κινητού μου,,γίνομαι εξόφληση οφειλή κινητός
επιθυμώ λεπτά ομιλίας για το καρτοκινητό μου,,επιθυμώ λεπτό ομιλία καρτοκινητός
θέλω να ενεργοποιήσω,,ενεργοποιήσω
να κάνω εξόφληση της οφειλής του κινητού μου,,εξόφληση οφειλή κινητός
θέλω να εξοφλήσω το κινητό μου,,εξοφλώ κινητό
θέλω νέο διακανονισμό για το κινητό,,νέος διακανονισμός κινητό
θέλω να ενημερωθώ για το χρέος μου,,ενημερωθώ χρέος
με ποιον τρόπο μπορώ να υποβάλω αίτηση,,τρόπος μπορώ υποβάλω αίτηση
ολοκλήρωση της ανανέωσης,,ολοκλήρωση ανανέωση
να αποπληρώσω το κινητό μου,,αποπληρώσως κινητό
θέλω να μάθω για την εξόφληση λογαριασμού,,μάθω εξόφληση λογαριασμός
θέλω μία βοήθεια,,ένας βοήθεια
ζητώ να μου απενεργοποιήσετε,,ζητώ απενεργοποιήσω
επιθυμώ να υποβάλω αίτηση,,επιθυμώ υποβάλω αίτηση
τι κωδικό έχει το hotspot,,κωδικός hotspot
ενδιαφέρομαι για ανανέωση,,ενδιαφέρομαι ανανέωση
πώς να κάνω το κινητό μου tethering,,πώς κινητό tethering
ποιο είναι το σύνολο των χρεών μου,,ποιος σύνολο χρεών
θέλω να γίνει εξόφληση παραστατικού του tv μου,,γίνομαι εξόφληση παραστατικός tv
θα ήθελα να ενημερωθώ για τον τρόπο που μπορεί να γίνει αίτηση,,ενημερωθώ τρόπος μπορώ γίνομαι αίτηση
θέλω να κάνω το σταθερό μου απόρρητο,,σταθερός απόρρητο
υπηρεσία,,υπηρεσία
θα ήθελα να κάνω διακανονισμό σε όλο αυτό που χρωστάω,,διακανονισμός αυτός χρωστάω
ανάλυση εισερχομένων,,ανάλυση εισερχομένων
θέλω ενημέρωση,,ενημέρωση
θέλω να κάνω διακανονισμό στην τηλεόραση γιατί αδυνατώ να πληρώσω τον λογαριασμό,,διακανονισμός σε ο τηλεόραση γιατί αδυνατώ πληρώσω λογαριασμός
ενεργοποίηση hotspot,,ενεργοποίηση hotspot
επιθυμώ να ενημερωθώ για τον τρόπο που μπορεί να γίνει αίτηση,,επιθυμώ ενημερωθώ τρόπος μπορώ γίνομαι αίτηση
θέλω να αποκτήσω επιπλέον λεπτά ομιλίας για να μιλάω με φίλους,,αποκτώ επιπλέον λεπτό ομιλία μιλάως φίλος
οδηγίες για hotspot παρακαλώ,,οδηγία hotspot παρακαλώ
να μάθω πληροφορίες,,μάθω πληροφορία
αγορά προγράμματος μηνυμάτων,,αγορά πρόγραμμα μηνυμάτο
θέλω να συνδεθώ με το τμήμα πωλήσεων,,συνδεθώ τμήμα πωλήσεων
πώς να ενεργοποιήσω το tethering μέσω του κινητού μου,,πώς ενεργοποιήσω tethering μέσω κινητού
να γίνει ενεργοποίηση,,γίνομαι ενεργοποίηση
θα ήθελα να διακανονίσω το ποσό που σας χρωστάω,,διακανονίζω ποσό χρωστάω
επιθυμώ να απενεργοποιήσω,,επιθυμώ απενεργοποιώ
πώς μπορώ να δω μια ανάλυση όλων των κλήσεων και μηνυμάτων,,πώς μπορώ ένας ανάλυση όλος κλήσεων μηνυμάτο
να δηλώσω το σταθερό μου ως απόρρητο,,δηλώνω σταθερός ως απόρρητος
θέλω βοήθεια,,βοήθεια
θα ήθελα να μιλήσω με το τμήμα που κάνει διακανονισμούς,,μιλώ τμήμα διακανονισμός
θα μπορούσα να έχω πρόσβαση στην ανάλυση λογαριασμού σταθερού,,μπορούσας πρόσβαση σε ο ανάλυση λογαριασμός σταθερού
πώς ανοίγει το hotspot,,πώς ανοίγει hotspot
θέλω υπηρεσίες,,υπηρεσία
ενημερώστε με για την ανάλυση κλήσεων,,ενημερώστε ανάλυση κλήσεων
είχαμε μιλήσει για ένα ραντεβού,,μιλήσει ένας ραντεβού
θα ήθελα να καταχωρήσω αίτηση,,καταχωρώ αίτηση
θέλω να προσθέσω λεπτά ομιλίας,,προσθέσω λεπτός ομιλία
κάτι δεν πάει καλά με το hotspot,,κάτι πάει καλά hotspot
θέλω να αποπληρώσω το σταθερό μου,,αποπληρώσως σταθερός
πώς μπορώ να καταχωρήσω αίτηση,,πώς μπορώ καταχωρώ αίτηση
θέλω να κάνω εξόφληση λογαριασμού,,εξόφληση λογαριασμός
θα ήθελα να καταχωρήσω αίτημα,,καταχωρώ αίτημα
θέλω να ενημερωθώ για διακανονισμό,,ενημερωθώ διακανονισμός
χρόνο για να τα λέω,,χρόνος λέως
ανάλυση εισερχόμενων μηνυμάτων,,ανάλυση εισερχόμενος μηνυμάτο
βγήκε επιδότηση για το τηλέφωνό μου,,βγήκε επιδότηση τηλέφωνό
να κάνω εξόφληση λογαριασμού για το τηλέφωνό μου,,εξόφληση λογαριασμός τηλέφωνό
πώς μπορώ να κάνω διακανονισμό σταθερής τηλεφωνίας,,πώς μπορώ διακανονισμός σταθερής τηλεφωνία
πόσα χρήματα χρωστάω τελικά,,πόσος χρήμα χρωστάω τελικά
αγορά προγράμματος με χρόνο ομιλίας,,αγορά πρόγραμμα χρόνος ομιλία
έχω επιδότηση,,επιδότηση
άμεση πραγματοποίηση ανανέωσης,,άμεσος πραγματοποίηση ανανέωση
επιθυμώ να βάλω χρόνο ομιλίας,,επιθυμώ βάλω χρόνος ομιλία
να μπορώ να κάνω βιντεοκλήση,,μπορώ βιντεοκλήση
πληροφορίες για ένα ραντεβού,,πληροφορία ένας ραντεβού
θέλω να μάθω πόσα χρήματα οφείλω,,μάθω πόσος χρήμα οφείλω
θέλω ενεργοποίηση,,ενεργοποίηση
απόκρυψη,,απόκρυψη
θέλω να κάνω εξόφληση παραστατικού του σταθερού μου,,εξόφληση παραστατικός σταθερού
θα ήθελα ένα νέο tablet,,ένας νέος tablet
επιθυμώ να κάνω αίτημα,,επιθυμώ αίτημα
θέλω να κάνω ενεργοποίηση προγράμματος ομιλίας,,ενεργοποίηση πρόγραμμα ομιλία
θέλω να μου βάλετε λεπτά ομιλίας στο καρτοκινητό μου,,βάλετε λεπτό ομιλία σε ο καρτοκινητό
θέλω να γίνει αποπληρωμή λογαριασμού του κινητού μου,,γίνομαι αποπληρωμή λογαριασμός κινητού
θέλω να απενεργοποιήσω,,απενεργοποιώ
από πού βλέπω τα υπόλοιπα,,από πού βλέπω υπόλοιπος
να μου κάνετε ενεργοποίηση,,ενεργοποίηση
επιθυμώ να βάλω λεπτά ομιλίας,,επιθυμώ βάλω λεπτό ομιλία
περιμένω τον συνάδελφό σας να έρθει για το ραντεβού που έχουμε,,περιμένω συνάδελφος έρθει ραντεβού
θέλω να ενημερωθώ για τον τρόπο που μπορεί να γίνει αίτηση,,ενημερωθώ τρόπος μπορώ γίνομαι αίτηση
πότε έχει προγραμματιστεί το νέο ραντεβού,,πότε προγραμματίζω νέος ραντεβού
να κάνω εξόφληση λογαριασμού για το σταθερό μου,,εξόφληση λογαριασμός σταθερός
